herb,common_names,background,know,learned,safety
Pomegranate,"
Common Name: 
  Pomegranate","
The pomegranate fruit has a leathery rind (or husk) with many little pockets of edible seeds and juice inside.
Since ancient times, the pomegranate has been a symbol of fertility.
Researchers have studied all parts of the pomegranate for their potential health benefits. Those parts include the fruit, seed, seed oil, tannin-rich peel, root, leaf, and flower.
The pomegranate has been used as a dietary supplement for many conditions including wounds, heart conditions, intestinal problems, and as a gargle for a sore throat.
Pomegranate is made into capsules, extracts, teas, powders, and juice products.
","
We don’t have a lot of strong scientific evidence on the effects of pomegranate for people’s health.
","
A 2012 clinical trial of about 100 dialysis patients suggested that pomegranate juice may help ward off infections. In the study, the patients who were given pomegranate juice three times a week for a year had fewer hospitalizations for infections and fewer signs of inflammation, compared with patients who got the placebo.
Pomegranate extract in mouthwash may help control dental plaque, according to a small 2011 clinical trial with 30 healthy participants.
Pomegranate may help improve some signs of heart disease but the research isn’t definitive.
","
Some people, particularly those with plant allergies, may be allergic to pomegranate.
It’s unclear whether pomegranate interacts with the anticoagulant (blood thinning) medicine warfarin or drugs that work similarly in the body to warfarin.
Federal agencies have taken action against companies selling pomegranate juice and supplements for deceptive advertising and making drug-like claims about the products. For more on this, view the NCCIH Director’s Page entitled Excessive Claims.
"
Probiotics: In Depth,,"Probiotics are live microorganisms that are intended to have health benefits when consumed or applied to the body. They can be found in yogurt and other fermented foods, dietary supplements, and beauty products. ","Probiotics may contain a variety of microorganisms. The most common are bacteria that belong to groups called Lactobacillus and Bifidobacterium. Other bacteria may also be used as probiotics, and so may yeasts such as Saccharomyces boulardii. ","No, prebiotics aren’t the same as probiotics. Prebiotics are nondigestible food components that selectively stimulate the growth or activity of desirable microorganisms. ",Synbiotics are products that combine probiotics and prebiotics.
Red Clover,"
Common Names: 
  red clover, cow clover, meadow clover, wild clover",,,,
Red Yeast Rice: An Introduction,,"
Some red yeast rice products contain substantial amounts of monacolin K, which is chemically identical to the active ingredient in the cholesterol-lowering drug lovastatin. These products may lower blood cholesterol levels and can cause the same types of side effects and drug interactions as lovastatin.
Other red yeast rice products contain little or no monacolin K. It is not known whether these products have any effect on blood cholesterol levels.
Consumers have no way of knowing how much monacolin K is present in most red yeast rice products. The labels on these products usually state only the amount of red yeast rice that they contain, not the amount of monacolin K.
The U.S. Food and Drug Administration (FDA) has determined that red yeast rice products that contain more than trace amounts of monacolin K are unapproved new drugs and cannot be sold legally as dietary supplements.
Some red yeast rice products contain a contaminant called citrinin, which can cause kidney failure.
Tell all your health care providers about any complementary health approaches you use. Give them a full picture of what you do to manage your health. This will help ensure coordinated and safe care.
","Red yeast rice is made by culturing rice with various strains of the yeast Monascus purpureus. Some preparations of red yeast rice are used in food products in Chinese cuisine, including Peking duck. Others have been sold as dietary supplements to lower blood levels of cholesterol and related lipids.","
The same types of side effects that can occur in patients taking lovastatin as a drug can also occur in patients who take red yeast rice products that contain monacolin K. Potential side effects include myopathy (muscle symptoms such as pain and weakness), rhabdomyolysis (a condition in which muscle fibers break down, releasing substances into the bloodstream that can harm the kidneys), and liver toxicity. Each of these three side effects has been reported in people who were taking red yeast rice.
Red yeast rice supplements should not be used while pregnant or breastfeeding.
Lovastatin can interact with a variety of drugs to increase the risk of rhabdomyolysis; these drugs include other cholesterol-lowering agents, certain antibiotics, the antidepressant nefazodone, drugs used to treat fungal infections, and drugs used to treat HIV infection. Red yeast rice containing monacolin K could interact with drugs in the same way.
If the process of culturing red yeast rice is not carefully controlled, a substance called citrinin can form. Citrinin has been shown to cause kidney failure in experimental animals and genetic damage in human cells. In a 2011 analysis of red yeast rice products sold as dietary supplements, 4 of 11 products were found to contain this contaminant.
","Red yeast rice products that contain substantial amounts of monacolin K can lower blood cholesterol levels. Researchers have not reported results of any studies of red yeast rice products that contain little or no monacolin K, so whether these products have any effect on blood cholesterol is unknown."
S-Adenosyl-L-Methionine (SAMe): An Introduction,,"Research has evaluated several potential uses of SAMe, and a substantial number of studies on depression and liver diseases have been completed. However, some of the studies used injected SAMe, which may not have the same effects as SAMe taken as a dietary supplement.","SAMe was discovered in the early 1950s. It’s made in the body from methionine, an amino acid found in foods. It has been found to regulate key functions in living cells.",Depression,NCCIH-Funded Research
Sage,"
Common Names: 
  sage, common sage, garden sage, true sage","
Sage has a long history of use as a spice and for health purposes. It was used in ancient Egyptian, Roman, and Greek medicine. In Native American rituals, dried sage is burned to promote healing, wisdom, protection, and longevity.
Today, sage is used as a dietary supplement for digestive problems, sore mouth or throat, memory loss, and depression.
Sage leaves or their extracts are available as liquids, throat sprays, tablets, lozenges, and capsules.
","
We don’t know much about the health effects of sage because little research has been done on it.
","
Sage has not been clearly shown to be helpful for any health condition.
There have been a few studies of sage for sore throat, mood, memory, and blood cholesterol levels. However, the findings are preliminary, and some of the research is of poor quality.
","
Sage is generally recognized as safe by the U.S. Food and Drug Administration and is approved for food use as a spice or seasoning. However, some species of sage contain thujone, which can affect the nervous system. Extended use or taking large amounts of sage leaf or oil may result in restlessness, vomiting, vertigo, rapid heart rate, tremors, seizures, and kidney damage. Twelve drops or more of the essential oil is considered a toxic dose.
"
Saw Palmetto,"
Common Names: 
  saw palmetto, American dwarf palm tree, cabbage palm",,,,
Soy,"
Common Name: 
  soy",,,,
St. John's Wort,"
Common Names: 
  St. John’s wort, hypericum, Klamath weed, goatweed","
St. John’s wort is a plant with yellow flowers that has been used in traditional European medicine as far back as the ancient Greeks. The name St. John’s wort apparently refers to John the Baptist, as the plant blooms around the time of the feast of St. John the Baptist in late June.
Historically, St. John’s wort has been used for a variety of conditions, including kidney and lung ailments, insomnia, and depression, and to aid wound healing.
Currently, St. John’s wort is most often used as a dietary supplement for depression. People also use it as a dietary supplement for other conditions, including menopausal symptoms, attention-deficit hyperactivity disorder (ADHD), and obsessive-compulsive disorder. It is used topically for wound healing.
The flowering tops of St. John’s wort are used to prepare teas, tablets, capsules, and liquid extracts. Topical preparations are also available.
","
There has been extensive research on St. John’s wort, especially on its use for depression and on its interactions with medications. It has been clearly shown that St. John’s wort can interact in dangerous, sometimes life-threatening ways with a variety of medicines.
","
The results of studies on the effectiveness of St. John’s wort for depression are mixed. For more information, see the NCCIH fact sheet St. John’s Wort and Depression.
St. John’s wort has also been studied for conditions other than depression. For some, such as ADHD, irritable bowel syndrome, and quitting smoking, current evidence indicates that St. John’s wort is not helpful. For others, such as menopausal symptoms, premenstrual syndrome, and obsessive-compulsive disorder, the evidence is inconclusive.
","
St. John’s wort can weaken the effects of many medicines, including crucially important medicines such as

Antidepressants
Birth control pills
Cyclosporine, which prevents the body from rejecting transplanted organs
Digoxin, a heart medication
Some HIV drugs including indinavir
Some cancer medications including irinotecan
Warfarin, an anticoagulant (blood thinner).


Taking St. John’s wort with certain antidepressants or other drugs that affect serotonin, a substance produced by nerve cells, may lead to increased serotonin-related side effects, which may be potentially serious.
St. John’s wort may cause increased sensitivity to sunlight. Other side effects can include anxiety, dry mouth, dizziness, gastrointestinal symptoms, fatigue, headache, or sexual dysfunction.
"
Tea Tree Oil,"
Common Names: 
  tea tree oil, tea tree, Australian tea tree oil, tea tree essential oil, melaleuca oil",,,,
Thunder God Vine,"
Common Names: 
  thunder god vine, lei gong teng",,,,
Turmeric,"
Common Names: 
  turmeric, turmeric root, Indian saffron","
Turmeric, a plant related to ginger, is grown throughout India, other parts of Asia, and Central America.
Historically, turmeric has been used in Ayurvedic medicine, primarily in South Asia, for many conditions, including breathing problems, rheumatism, serious pain, and fatigue.
Today, turmeric is used as a dietary supplement for inflammation; arthritis; stomach, skin, liver, and gallbladder problems; cancer; and other conditions.
Turmeric is a common spice and a major ingredient in curry powder. Its primary active ingredients, curcuminoids, are yellow and used to color foods and cosmetics.
Turmeric’s underground stems (rhizomes) are dried and made into capsules, tablets, teas, or extracts. Turmeric powder is also made into a paste for skin conditions.
","
We have a lot of research, including studies done in people, on turmeric for a variety of health conditions.
","
Claims that curcuminoids found in turmeric help to reduce inflammation aren’t supported by strong studies.
Preliminary studies found that curcuminoids may

Reduce the number of heart attacks bypass patients had after surgery
Control knee pain from osteoarthritis as well as ibuprofen did
Reduce the skin irritation that often occurs after radiation treatments for breast cancer.


Other preliminary studies in people have looked at curcumin, a type of curcuminoid, for different cancers, colitis, diabetes, surgical pain, and as an ingredient in mouthwash for reducing plaque.
The National Center for Complementary and Integrative Health (NCCIH) has studied curcumin for Alzheimer’s disease, rheumatoid arthritis, and prostate and colon cancer.
","
Turmeric in amounts tested for health purposes is generally considered safe when taken by mouth or applied to the skin.
High doses or long-term use of turmeric may cause gastrointestinal problems.
"
Valerian,"
Common Names: 
  valerian, all-heal, garden heliotrope","
Valerian is a plant native to Europe and Asia; it also grows in North America.
Valerian has been used medicinally since the times of early Greece and Rome; Hippocrates wrote about its uses. Historically, valerian was used to treat nervousness, trembling, headaches, and heart palpitations.
Today, valerian is used as a dietary supplement for insomnia, anxiety, and other conditions such as depression and menopause symptoms.
The roots and rhizomes (underground stems) of valerian are used to make capsules, tablets, and liquid extracts, as well as teas.
","
Knowledge about valerian is limited because there have been only a small number of high-quality studies in people.
","
The evidence on whether valerian is helpful for sleep problems is inconsistent.
There’s not enough evidence to allow any conclusions about whether valerian can relieve anxiety, depression, or menopausal symptoms.
","
Studies suggest that valerian is generally safe for use by most healthy adults for short periods of time.
No information is available about the long-term safety of valerian or its safety in children younger than age 3, pregnant women, or nursing mothers.
Few side effects have been reported in studies of valerian. Those that have occurred include headache, dizziness, itching, and digestive disturbances.
Because it is possible (though not proven) that valerian might have a sleep-inducing effect, it should not be taken along with alcohol or sedatives.
"
Yohimbe,"
Common Names: 
  yohimbe, johimbe","
Yohimbe is an evergreen tree native to western Africa. It has a compound called yohimbine in its bark. The bark is used to make extracts, tablets, and capsules.
In parts of Africa, tea made from yohimbe bark has been used as an aphrodisiac (to increase sexual desire).
Yohimbe is used as a dietary supplement for impotence, athletic performance, weight loss, chest pain, high blood pressure, diabetic neuropathy, and more.
Yohimbine hydrochloride, a standardized form of yohimbine, is available in the United States as a prescription drug for erectile dysfunction. This is a different product than dietary supplements made from the bark of the tree.
","
There is very little research in people on the effects of yohimbe as a dietary supplement. But studies have documented the risks of taking it.
","
The amount of yohimbine in dietary supplements may vary; some yohimbe products contain very little yohimbine.
Yohimbe sold as a dietary supplement may not work like the prescription medication that contains yohimbine.
","
Yohimbe has been associated with heart attacks and seizures.
Yohimbe caused stomach problems, tachycardia (a rapid heartbeat), anxiety, and high blood pressure, according to a study comparing calls about yohimbe and other substances made to the California Poison Control System between 2000 and 2006. People calling about yohimbe were generally more likely to need medical care than other callers.
Most yohimbe products don’t say how much yohimbine they contain. The amount may vary a lot among products, according to a recent analysis of 49 brands of supplements labeled as containing yohimbe or yohimbine for sale in the United States. Some of the yohimbine was either synthetic or from highly processed plant extract.
"
